{
  "$schema": "https://json-schema.org/draft/2020-12/schema",
  "$id": "https://raw.githubusercontent.com/abrosdaniel/rivet/HEAD/rivet/core/src/main/resources/rivet/schemas/v1/project.schema.json",
  "type": "object",
  "additionalProperties": false,
  "properties": {
    "schemaVersion": {
      "const": 1
    },
    "content": {
      "type": "object",
      "additionalProperties": false,
      "properties": {
        "rules": {
          "type": "string",
          "minLength": 1,
          "maxLength": 512
        },
        "news": {
          "type": "string",
          "minLength": 1,
          "maxLength": 512
        },
        "changelog": {
          "type": "string",
          "minLength": 1,
          "maxLength": 512
        }
      },
      "required": []
    },
    "minecraft": {
      "type": "object",
      "additionalProperties": false,
      "properties": {
        "version": {
          "type": "string",
          "minLength": 1,
          "maxLength": 512
        },
        "loader": {
          "const": "neoforge"
        },
        "loaderVersion": {
          "type": "string",
          "minLength": 1,
          "maxLength": 512
        }
      },
      "required": [
        "version",
        "loaderVersion"
      ]
    },
    "policies": {
      "type": "object",
      "additionalProperties": false,
      "properties": {
        "customFiles": {
          "enum": [
            "warn",
            "deny"
          ]
        }
      },
      "required": [
        "customFiles"
      ]
    },
    "integrations": {
      "type": "object",
      "additionalProperties": false,
      "properties": {
        "luckperms": {
          "type": "boolean"
        }
      },
      "required": [
        "luckperms"
      ]
    },
    "theme": {
      "type": "object",
      "additionalProperties": false,
      "properties": {
        "accent": {
          "type": "string",
          "pattern": "^#[0-9a-fA-F]{6}$"
        },
        "icon": {
          "type": "string",
          "minLength": 1,
          "maxLength": 512
        },
        "logo": {
          "type": "string",
          "minLength": 1,
          "maxLength": 512
        },
        "banner": {
          "type": "string",
          "minLength": 1,
          "maxLength": 512
        }
      },
      "required": []
    },
    "server": {
      "type": "object",
      "additionalProperties": false,
      "properties": {
        "address": {
          "type": "string",
          "minLength": 1,
          "maxLength": 512
        }
      },
      "required": [
        "address"
      ]
    },
    "name": {
      "type": "string",
      "minLength": 1,
      "maxLength": 512,
      "pattern": ".*\\S.*"
    },
    "version": {
      "type": "string",
      "pattern": "^(0|[1-9][0-9]*)\\.(0|[1-9][0-9]*)\\.(0|[1-9][0-9]*)$"
    },
    "components": {
      "type": "array",
      "items": {
        "type": "object",
        "additionalProperties": false,
        "properties": {
          "id": {
            "type": "string",
            "pattern": "^[a-z0-9][a-z0-9-]{0,63}$"
          },
          "name": {
            "type": "string",
            "minLength": 1,
            "maxLength": 512
          },
          "description": {
            "type": "string",
            "minLength": 1,
            "maxLength": 512
          },
          "kind": {
            "enum": [
              "required",
              "recommended",
              "optional"
            ]
          },
          "category": {
            "type": "string",
            "minLength": 1,
            "maxLength": 512
          },
          "dependencies": {
            "type": "array",
            "items": {
              "type": "string",
              "pattern": "^[a-z0-9][a-z0-9-]{0,63}$"
            },
            "maxItems": 2000,
            "uniqueItems": true
          },
          "conflicts": {
            "type": "array",
            "items": {
              "type": "string",
              "pattern": "^[a-z0-9][a-z0-9-]{0,63}$"
            },
            "maxItems": 2000,
            "uniqueItems": true
          },
          "files": {
            "type": "array",
            "items": {
              "type": "object",
              "additionalProperties": false,
              "properties": {
                "path": {
                  "type": "string",
                  "minLength": 1,
                  "maxLength": 512
                },
                "version": {
                  "type": "string",
                  "minLength": 1,
                  "maxLength": 512
                },
                "repositoryPath": {
                  "type": "string",
                  "minLength": 1,
                  "maxLength": 512
                },
                "policy": {
                  "enum": [
                    "enforce",
                    "update",
                    "preserve"
                  ]
                },
                "sha256": {
                  "type": "string",
                  "pattern": "^[0-9a-f]{64}$"
                },
                "urls": {
                  "type": "array",
                  "minItems": 1,
                  "maxItems": 8,
                  "uniqueItems": true,
                  "items": {
                    "type": "string",
                    "pattern": "^https://",
                    "maxLength": 2048
                  }
                }
              },
              "required": [
                "path"
              ],
              "anyOf": [
                {
                  "required": [
                    "urls"
                  ]
                },
                {
                  "required": [
                    "repositoryPath"
                  ]
                }
              ]
            },
            "maxItems": 10000
          }
        },
        "required": [
          "id",
          "name",
          "files"
        ]
      },
      "maxItems": 2000
    },
    "rivetVersion": {
      "type": "string",
      "pattern": "^((0|[1-9][0-9]*)\\.(x(\\.x)?|(0|[1-9][0-9]*)\\.(x|0|[1-9][0-9]*))|=(0|[1-9][0-9]*)\\.(0|[1-9][0-9]*)\\.(0|[1-9][0-9]*)|>=(0|[1-9][0-9]*)\\.(0|[1-9][0-9]*)\\.(0|[1-9][0-9]*) <(0|[1-9][0-9]*)\\.(0|[1-9][0-9]*)\\.(0|[1-9][0-9]*))$",
      "description": "Release family (1.x), explicit bounded range (>=1.1.0 <2.0.0) or exact release (=1.1.0). Legacy 1.x.x, 1.1.x and bare 1.1.0 remain supported.",
      "x-patternMessage": "Укажите требование Rivet: 1.x, >=1.1.0 <2.0.0 или =1.1.0. Старые 3.4.x и A.B.C также поддерживаются.",
      "x-rivetRequirement": true
    }
  },
  "required": [
    "name",
    "version",
    "server",
    "minecraft",
    "components",
    "rivetVersion"
  ]
}
